{
  "accepted": false,
  "artifact_id": "episode-benchmark-comparison:f000477:justice_public_safety:119:v1",
  "authorizing": false,
  "benchmark_accessed_after_freeze": true,
  "candidate": true,
  "canonical": false,
  "comparison_count": 5,
  "comparisons": [
    {
      "accepted_benchmark_episode_id": "halt-fentanyl-legislative-path",
      "action_role_agreement": true,
      "benchmark_action_ids": [
        "house:119:1:32",
        "house:119:1:33",
        "house:119:1:166"
      ],
      "candidate_episode_id": "halt-fentanyl-legislative-path",
      "comparison_only_no_candidate_mutation": true,
      "content_subject_sha256": "b9755682e32f196e9d8b5ce3bd25949c6c560c4b64512736e3565e14bb7a0494",
      "explanation": "Frozen candidate membership, question, roles, and bounded scope agree with the accepted benchmark structure for the benchmark actions.",
      "material_scope_agreement": true,
      "membership_agreement": true,
      "policy_question_agreement": true,
      "severity": "none"
    },
    {
      "accepted_benchmark_episode_id": "retired-service-weapon-purchases",
      "action_role_agreement": true,
      "benchmark_action_ids": [
        "house:119:1:130"
      ],
      "candidate_episode_id": "retired-service-weapon-purchases",
      "comparison_only_no_candidate_mutation": true,
      "content_subject_sha256": "6327098155d430bd4c9680aa087bf442c36e050091eca498a0c36cc55931e470",
      "explanation": "Frozen candidate membership, question, roles, and bounded scope agree with the accepted benchmark structure for the benchmark actions.",
      "material_scope_agreement": true,
      "membership_agreement": true,
      "policy_question_agreement": true,
      "severity": "none"
    },
    {
      "accepted_benchmark_episode_id": "officer-safety-data-reporting",
      "action_role_agreement": true,
      "benchmark_action_ids": [
        "house:119:1:131"
      ],
      "candidate_episode_id": "officer-safety-data-reporting",
      "comparison_only_no_candidate_mutation": true,
      "content_subject_sha256": "d1135099aca6f394e7a70f40b2af2fe147c8cdc177dcc4cc620f80514c554a82",
      "explanation": "Frozen candidate membership, question, roles, and bounded scope agree with the accepted benchmark structure for the benchmark actions.",
      "material_scope_agreement": true,
      "membership_agreement": true,
      "policy_question_agreement": true,
      "severity": "none"
    },
    {
      "accepted_benchmark_episode_id": "dc-police-pursuit-rules",
      "action_role_agreement": true,
      "benchmark_action_ids": [
        "house:119:1:275"
      ],
      "candidate_episode_id": "dc-police-pursuit-rules",
      "comparison_only_no_candidate_mutation": true,
      "content_subject_sha256": "0a54ee561b7f8521a36aa1e126950b7711aff50de8b39935bc72165cf93a4f0b",
      "explanation": "Frozen candidate membership, question, roles, and bounded scope agree with the accepted benchmark structure for the benchmark actions.",
      "material_scope_agreement": true,
      "membership_agreement": true,
      "policy_question_agreement": true,
      "severity": "none"
    },
    {
      "accepted_benchmark_episode_id": "dc-policing-reform-repeal",
      "action_role_agreement": true,
      "benchmark_action_ids": [
        "house:119:1:299"
      ],
      "candidate_episode_id": "dc-policing-reform-repeal",
      "comparison_only_no_candidate_mutation": true,
      "content_subject_sha256": "ce6fd6a83d159fc06c66a9f46baa2f2556f58c4e6e11944fdc1fbafa76dfcb33",
      "explanation": "Frozen candidate membership, question, roles, and bounded scope agree with the accepted benchmark structure for the benchmark actions.",
      "material_scope_agreement": true,
      "membership_agreement": true,
      "policy_question_agreement": true,
      "severity": "none"
    }
  ],
  "content_subject_sha256": "7be945bcaef2757eaf19588c7879113a556f5fd65b5939f5556687ae7bac0798",
  "frozen_batch_content_subject_sha256": "c7d5c3567fa606420a9e49fd01b4dcef70a728295626b3b9c9d4dfad6ec097b6",
  "public": false,
  "schema_version": "episode_benchmark_comparison_v1",
  "severity_counts": {
    "critical": 0,
    "major": 0,
    "none": 5
  }
}
